,human_suggested_id,address1,address2,address3,country,fulladdress,assetdescription,additionalassetdescription,receiversfirm,concat,concat_clean,token,token_clean,label
0,,Dolmen Hotel,"Kilkenny Road, Carlow",Carlow,Ireland,"Dolmen Hotel, Kilkenny Road, Carlow, Carlow, Ireland",Hotel,,KPMG,"Dolmen Hotel Kilkenny Road, Carlow Carlow Ireland Dolmen Hotel, Kilkenny Road, Carlow, Carlow, Ireland Hotel nan KPMG","dolmen hotel kilkenny road, carlow carlow ireland dolmen hotel, kilkenny road, carlow, carlow, ireland hotel  kpmg","['dolmen', 'hotel', 'kilkenny', 'road', ',', 'carlow', 'carlow', 'ireland', 'dolmen', 'hotel', ',', 'kilkenny', 'road', ',', 'carlow', ',', 'carlow', ',', 'ireland', 'hotel', 'kpmg']",dolmen hotel kilkenny road carlow carlow ireland dolmen hotel kilkenny road carlow carlow ireland hotel kpmg,3
158,,Castleforbes House,Castleforbes Road,Dublin 1,Ireland,"Castleforbes House, Castleforbes Road, Dublin 1, Ireland",Mixed Use,,Deloitte,"Castleforbes House Castleforbes Road Dublin 1 Ireland Castleforbes House, Castleforbes Road, Dublin 1, Ireland Mixed Use nan Deloitte","castleforbes house castleforbes road dublin_1 ireland castleforbes house, castleforbes road, dublin_1, ireland mixed use deloitte","['castleforbes', 'house', 'castleforbes', 'road', 'dublin_1', 'ireland', 'castleforbes', 'house', ',', 'castleforbes', 'road', ',', 'dublin_1', ',', 'ireland', 'mixed', 'use', 'deloitte']",castleforbes house castleforbes road dublin_1 ireland castleforbes house castleforbes road dublin_1 ireland mixed use deloitte,3
159,,Castleforbes Square,Castleforbes Road,Dublin 1,Ireland,"Castleforbes Square, Castleforbes Road, Dublin 1, Ireland",Residential,,Deloitte,"Castleforbes Square Castleforbes Road Dublin 1 Ireland Castleforbes Square, Castleforbes Road, Dublin 1, Ireland Residential nan Deloitte","castleforbes square castleforbes road dublin_1 ireland castleforbes square, castleforbes road, dublin_1, ireland residential deloitte","['castleforbes', 'square', 'castleforbes', 'road', 'dublin_1', 'ireland', 'castleforbes', 'square', ',', 'castleforbes', 'road', ',', 'dublin_1', ',', 'ireland', 'residential', 'deloitte']",castleforbes square castleforbes road dublin_1 ireland castleforbes square castleforbes road dublin_1 ireland residential deloitte,3
160,,Clarion Hotel,IFSC,Dublin 1,Ireland,"Clarion Hotel, IFSC, Dublin 1, Ireland",Hotel,,KPMG,"Clarion Hotel IFSC Dublin 1 Ireland Clarion Hotel, IFSC, Dublin 1, Ireland Hotel nan KPMG","clarion hotel ifsc dublin_1 ireland clarion hotel, ifsc, dublin_1, ireland hotel kpmg","['clarion', 'hotel', 'ifsc', 'dublin_1', 'ireland', 'clarion', 'hotel', ',', 'ifsc', ',', 'dublin_1', ',', 'ireland', 'hotel', 'kpmg']",clarion hotel ifsc dublin_1 ireland clarion hotel ifsc dublin_1 ireland hotel kpmg,3
161,,Block 1,North Wall Quay,Dublin 1,Ireland,"Block 1, North Wall Quay, Dublin 1, Ireland",Development - Commenced,,McStay Luby,"Block 1 North Wall Quay Dublin 1 Ireland Block 1, North Wall Quay, Dublin 1, Ireland Development - Commenced nan McStay Luby","block 1 north wall quay dublin_1 ireland block 1, north wall quay, dublin_1, ireland development - commenced mcstay luby","['block', '1', 'north', 'wall', 'quay', 'dublin_1', 'ireland', 'block', '1', ',', 'north', 'wall', 'quay', ',', 'dublin_1', ',', 'ireland', 'development', '-', 'commenced', 'mcstay', 'luby']",block 1 north wall quay dublin_1 ireland block 1 north wall quay dublin_1 ireland development commenced mcstay luby,3
162,,Northbank,Sheriff Street,Dublin 1,Ireland,"Northbank, Sheriff Street, Dublin 1, Ireland",Residential,,Deloitte,"Northbank Sheriff Street Dublin 1 Ireland Northbank, Sheriff Street, Dublin 1, Ireland Residential nan Deloitte","northbank sheriff street dublin_1 ireland northbank, sheriff street, dublin_1, ireland residential deloitte","['northbank', 'sheriff', 'street', 'dublin_1', 'ireland', 'northbank', ',', 'sheriff', 'street', ',', 'dublin_1', ',', 'ireland', 'residential', 'deloitte']",northbank sheriff street dublin_1 ireland northbank sheriff street dublin_1 ireland residential deloitte,3
163,,Day's Inn,Talbot Street,Dublin 1,Ireland,"Day's Inn, Talbot Street, Dublin 1, Ireland",Hotel,,KPMG,"Day's Inn Talbot Street Dublin 1 Ireland Day's Inn, Talbot Street, Dublin 1, Ireland Hotel nan KPMG","day's inn talbot street dublin_1 ireland day's inn, talbot street, dublin_1, ireland hotel kpmg","['day', ""'s"", 'inn', 'talbot', 'street', 'dublin_1', 'ireland', 'day', ""'s"", 'inn', ',', 'talbot', 'street', ',', 'dublin_1', ',', 'ireland', 'hotel', 'kpmg']",day 's inn talbot street dublin_1 ireland day 's inn talbot street dublin_1 ireland hotel kpmg,3
164,,Great Strand Street,,Dublin 1,Ireland,"Great Strand Street, Dublin 1, Ireland",Development - Commenced,,Ferris & Associates,"Great Strand Street nan Dublin 1 Ireland Great Strand Street, Dublin 1, Ireland Development - Commenced nan Ferris & Associates","great strand street dublin_1 ireland great strand street, dublin_1, ireland development - commenced ferris & associates","['great', 'strand', 'street', 'dublin_1', 'ireland', 'great', 'strand', 'street', ',', 'dublin_1', ',', 'ireland', 'development', '-', 'commenced', 'ferris', '&', 'associates']",great strand street dublin_1 ireland great strand street dublin_1 ireland development commenced ferris associates,3
165,,Ormond Quay,,Dublin 1,Ireland,"Ormond Quay, Dublin 1, Ireland",Office,,RSM Farrell Grant Sparks,"Ormond Quay nan Dublin 1 Ireland Ormond Quay, Dublin 1, Ireland Office nan RSM Farrell Grant Sparks","ormond quay dublin_1 ireland ormond quay, dublin_1, ireland office rsm farrell grant sparks","['ormond', 'quay', 'dublin_1', 'ireland', 'ormond', 'quay', ',', 'dublin_1', ',', 'ireland', 'office', 'rsm', 'farrell', 'grant', 'sparks']",ormond quay dublin_1 ireland ormond quay dublin_1 ireland office rsm farrell grant sparks,3
166,,"Sheriff St Upper, New
Wapping Street and
Mayor Street Upper",,Dublin 1,Ireland,"Sheriff St Upper, New
Wapping Street and
Mayor Street Upper, Dublin 1, Ireland",Development - Not Commenced,,PwC,"Sheriff St Upper, New
Wapping Street and
Mayor Street Upper nan Dublin 1 Ireland Sheriff St Upper, New
Wapping Street and
Mayor Street Upper, Dublin 1, Ireland Development - Not Commenced nan PwC","sheriff st upper, new wapping street and mayor street upper dublin_1 ireland sheriff st upper, new wapping street and mayor street upper, dublin_1, ireland development - not commenced pwc","['sheriff', 'st', 'upper', ',', 'new', 'wapping', 'street', 'and', 'mayor', 'street', 'upper', 'dublin_1', 'ireland', 'sheriff', 'st', 'upper', ',', 'new', 'wapping', 'street', 'and', 'mayor', 'street', 'upper', ',', 'dublin_1', ',', 'ireland', 'development', '-', 'not', 'commenced', 'pwc']",sheriff st upper new wapping street and mayor street upper dublin_1 ireland sheriff st upper new wapping street and mayor street upper dublin_1 ireland development not commenced pwc,3
167,,Sheriff St,,Dublin 1,Ireland,"Sheriff St, Dublin 1, Ireland",Development - Not Commenced,,PwC,"Sheriff St nan Dublin 1 Ireland Sheriff St, Dublin 1, Ireland Development - Not Commenced nan PwC","sheriff st dublin_1 ireland sheriff st, dublin_1, ireland development - not commenced pwc","['sheriff', 'st', 'dublin_1', 'ireland', 'sheriff', 'st', ',', 'dublin_1', ',', 'ireland', 'development', '-', 'not', 'commenced', 'pwc']",sheriff st dublin_1 ireland sheriff st dublin_1 ireland development not commenced pwc,3
168,,Mayor Street Upper,,Dublin 1,Ireland,"Mayor Street Upper, Dublin 1, Ireland",Development - Not Commenced,,PwC,"Mayor Street Upper nan Dublin 1 Ireland Mayor Street Upper, Dublin 1, Ireland Development - Not Commenced nan PwC","mayor street upper dublin_1 ireland mayor street upper, dublin_1, ireland development - not commenced pwc","['mayor', 'street', 'upper', 'dublin_1', 'ireland', 'mayor', 'street', 'upper', ',', 'dublin_1', ',', 'ireland', 'development', '-', 'not', 'commenced', 'pwc']",mayor street upper dublin_1 ireland mayor street upper dublin_1 ireland development not commenced pwc,3
169,,"Castleforbes Road,
Mayor Street Upper
and North Wall Quay",,Dublin 1,Ireland,"Castleforbes Road,
Mayor Street Upper
and North Wall Quay, Dublin 1, Ireland",Development - Not Commenced,,PwC,"Castleforbes Road,
Mayor Street Upper
and North Wall Quay nan Dublin 1 Ireland Castleforbes Road,
Mayor Street Upper
and North Wall Quay, Dublin 1, Ireland Development - Not Commenced nan PwC","castleforbes road, mayor street upper and north wall quay dublin_1 ireland castleforbes road, mayor street upper and north wall quay, dublin_1, ireland development - not commenced pwc","['castleforbes', 'road', ',', 'mayor', 'street', 'upper', 'and', 'north', 'wall', 'quay', 'dublin_1', 'ireland', 'castleforbes', 'road', ',', 'mayor', 'street', 'upper', 'and', 'north', 'wall', 'quay', ',', 'dublin_1', ',', 'ireland', 'development', '-', 'not', 'commenced', 'pwc']",castleforbes road mayor street upper and north wall quay dublin_1 ireland castleforbes road mayor street upper and north wall quay dublin_1 ireland development not commenced pwc,3
170,,"Mayor Street Upper
and Castleforbes
Road",,Dublin 1,Ireland,"Mayor Street Upper
and Castleforbes
Road, Dublin 1, Ireland",Development - Commenced,,PwC,"Mayor Street Upper
and Castleforbes
Road nan Dublin 1 Ireland Mayor Street Upper
and Castleforbes
Road, Dublin 1, Ireland Development - Commenced nan PwC","mayor street upper and castleforbes road dublin_1 ireland mayor street upper and castleforbes road, dublin_1, ireland development - commenced pwc","['mayor', 'street', 'upper', 'and', 'castleforbes', 'road', 'dublin_1', 'ireland', 'mayor', 'street', 'upper', 'and', 'castleforbes', 'road', ',', 'dublin_1', ',', 'ireland', 'development', '-', 'commenced', 'pwc']",mayor street upper and castleforbes road dublin_1 ireland mayor street upper and castleforbes road dublin_1 ireland development commenced pwc,3
171,,Arran Quay Terrace,,Dublin 1,Ireland,"Arran Quay Terrace, Dublin 1, Ireland",Development - Not Commenced,,PwC,"Arran Quay Terrace nan Dublin 1 Ireland Arran Quay Terrace, Dublin 1, Ireland Development - Not Commenced nan PwC","arran quay terrace dublin_1 ireland arran quay terrace, dublin_1, ireland development - not commenced pwc","['arran', 'quay', 'terrace', 'dublin_1', 'ireland', 'arran', 'quay', 'terrace', ',', 'dublin_1', ',', 'ireland', 'development', '-', 'not', 'commenced', 'pwc']",arran quay terrace dublin_1 ireland arran quay terrace dublin_1 ireland development not commenced pwc,3
172,,North Wall Quay,,Dublin 1,Ireland,"North Wall Quay, Dublin 1, Ireland",Development - Commenced,,PwC,"North Wall Quay nan Dublin 1 Ireland North Wall Quay, Dublin 1, Ireland Development - Commenced nan PwC","north wall quay dublin_1 ireland north wall quay, dublin_1, ireland development - commenced pwc","['north', 'wall', 'quay', 'dublin_1', 'ireland', 'north', 'wall', 'quay', ',', 'dublin_1', ',', 'ireland', 'development', '-', 'commenced', 'pwc']",north wall quay dublin_1 ireland north wall quay dublin_1 ireland development commenced pwc,3
173,,Upper Abbey Street,,Dublin 1,Ireland,"Upper Abbey Street, Dublin 1, Ireland",Development - Not Commenced,,PwC,"Upper Abbey Street nan Dublin 1 Ireland Upper Abbey Street, Dublin 1, Ireland Development - Not Commenced nan PwC","upper abbey street dublin_1 ireland upper abbey street, dublin_1, ireland development - not commenced pwc","['upper', 'abbey', 'street', 'dublin_1', 'ireland', 'upper', 'abbey', 'street', ',', 'dublin_1', ',', 'ireland', 'development', '-', 'not', 'commenced', 'pwc']",upper abbey street dublin_1 ireland upper abbey street dublin_1 ireland development not commenced pwc,3
174,,Upper Dorset Street,,Dublin 1,Ireland,"Upper Dorset Street, Dublin 1, Ireland",Mixed Use,,DTZ Sherry FitzGerald,"Upper Dorset Street nan Dublin 1 Ireland Upper Dorset Street, Dublin 1, Ireland Mixed Use nan DTZ Sherry FitzGerald","upper dorset street dublin_1 ireland upper dorset street, dublin_1, ireland mixed use dtz sherry fitzgerald","['upper', 'dorset', 'street', 'dublin_1', 'ireland', 'upper', 'dorset', 'street', ',', 'dublin_1', ',', 'ireland', 'mixed', 'use', 'dtz', 'sherry', 'fitzgerald']",upper dorset street dublin_1 ireland upper dorset street dublin_1 ireland mixed use dtz sherry fitzgerald,3
175,,Parkview,Finglas,Dublin 11,Ireland,"Parkview, Finglas, Dublin 11, Ireland",Development - Commenced,,Grant Thornton,"Parkview Finglas Dublin 11 Ireland Parkview, Finglas, Dublin 11, Ireland Development - Commenced nan Grant Thornton","parkview finglas dublin_11 ireland parkview, finglas, dublin_11, ireland development - commenced grant thornton","['parkview', 'finglas', 'dublin_11', 'ireland', 'parkview', ',', 'finglas', ',', 'dublin_11', ',', 'ireland', 'development', '-', 'commenced', 'grant', 'thornton']",parkview finglas dublin_11 ireland parkview finglas dublin_11 ireland development commenced grant thornton,3
176,,"Centrepoint Business
Park",Clondalkin,Dublin 12,Ireland,"Centrepoint Business
Park, Clondalkin, Dublin 12, Ireland",Office,,Grant Thornton,"Centrepoint Business
Park Clondalkin Dublin 12 Ireland Centrepoint Business
Park, Clondalkin, Dublin 12, Ireland Office nan Grant Thornton","centrepoint business park clondalkin dublin_12 ireland centrepoint business park, clondalkin, dublin_12, ireland office grant thornton","['centrepoint', 'business', 'park', 'clondalkin', 'dublin_12', 'ireland', 'centrepoint', 'business', 'park', ',', 'clondalkin', ',', 'dublin_12', ',', 'ireland', 'office', 'grant', 'thornton']",centrepoint business park clondalkin dublin_12 ireland centrepoint business park clondalkin dublin_12 ireland office grant thornton,3
177,,Davitt Road,Crumlin,Dublin 12,Ireland,"Davitt Road, Crumlin, Dublin 12, Ireland",Development - Not Commenced,,Deloitte,"Davitt Road Crumlin Dublin 12 Ireland Davitt Road, Crumlin, Dublin 12, Ireland Development - Not Commenced nan Deloitte","davitt road crumlin dublin_12 ireland davitt road, crumlin, dublin_12, ireland development - not commenced deloitte","['davitt', 'road', 'crumlin', 'dublin_12', 'ireland', 'davitt', 'road', ',', 'crumlin', ',', 'dublin_12', ',', 'ireland', 'development', '-', 'not', 'commenced', 'deloitte']",davitt road crumlin dublin_12 ireland davitt road crumlin dublin_12 ireland development not commenced deloitte,3
178,,Drimagh Road,Drimnagh,Dublin 12,Ireland,"Drimagh Road, Drimnagh, Dublin 12, Ireland",Development - Not Commenced,,Savills,"Drimagh Road Drimnagh Dublin 12 Ireland Drimagh Road, Drimnagh, Dublin 12, Ireland Development - Not Commenced nan Savills","drimagh road drimnagh dublin_12 ireland drimagh road, drimnagh, dublin_12, ireland development - not commenced savills","['drimagh', 'road', 'drimnagh', 'dublin_12', 'ireland', 'drimagh', 'road', ',', 'drimnagh', ',', 'dublin_12', ',', 'ireland', 'development', '-', 'not', 'commenced', 'savills']",drimagh road drimnagh dublin_12 ireland drimagh road drimnagh dublin_12 ireland development not commenced savills,3
179,,Cromwellsfort Road,Walkinstown,Dublin 12,Ireland,"Cromwellsfort Road, Walkinstown, Dublin 12, Ireland",Retail,,"Russell Brennan Keane
Corporate Recovery","Cromwellsfort Road Walkinstown Dublin 12 Ireland Cromwellsfort Road, Walkinstown, Dublin 12, Ireland Retail nan Russell Brennan Keane
Corporate Recovery","cromwellsfort road walkinstown dublin_12 ireland cromwellsfort road, walkinstown, dublin_12, ireland retail russell bren keane corporate recovery","['cromwellsfort', 'road', 'walkinstown', 'dublin_12', 'ireland', 'cromwellsfort', 'road', ',', 'walkinstown', ',', 'dublin_12', ',', 'ireland', 'retail', 'russell', 'bren', 'keane', 'corporate', 'recovery']",cromwellsfort road walkinstown dublin_12 ireland cromwellsfort road walkinstown dublin_12 ireland retail russell bren keane corporate recovery,3
181,,Hazel Brook Square,Churchtown,Dublin 14,Ireland,"Hazel Brook Square, Churchtown, Dublin 14, Ireland",Development - Commenced,,Mazars,"Hazel Brook Square Churchtown Dublin 14 Ireland Hazel Brook Square, Churchtown, Dublin 14, Ireland Development - Commenced nan Mazars","hazel brook square churchtown dublin_14 ireland hazel brook square, churchtown, dublin_14, ireland development - commenced mazars","['hazel', 'brook', 'square', 'churchtown', 'dublin_14', 'ireland', 'hazel', 'brook', 'square', ',', 'churchtown', ',', 'dublin_14', ',', 'ireland', 'development', '-', 'commenced', 'mazars']",hazel brook square churchtown dublin_14 ireland hazel brook square churchtown dublin_14 ireland development commenced mazars,3
182,,Hazel Brook Square,Churchtown,Dublin 14,Ireland,"Hazel Brook Square, Churchtown, Dublin 14, Ireland",Residential,,Mazars,"Hazel Brook Square Churchtown Dublin 14 Ireland Hazel Brook Square, Churchtown, Dublin 14, Ireland Residential nan Mazars","hazel brook square churchtown dublin_14 ireland hazel brook square, churchtown, dublin_14, ireland residential mazars","['hazel', 'brook', 'square', 'churchtown', 'dublin_14', 'ireland', 'hazel', 'brook', 'square', ',', 'churchtown', ',', 'dublin_14', ',', 'ireland', 'residential', 'mazars']",hazel brook square churchtown dublin_14 ireland hazel brook square churchtown dublin_14 ireland residential mazars,3
186,,Rathbourne,Ashtown,Dublin 15,Ireland,"Rathbourne, Ashtown, Dublin 15, Ireland",Residential,,Mazars,"Rathbourne Ashtown Dublin 15 Ireland Rathbourne, Ashtown, Dublin 15, Ireland Residential nan Mazars","rathbourne ashtown dublin_15 ireland rathbourne, ashtown, dublin_15, ireland residential mazars","['rathbourne', 'ashtown', 'dublin_15', 'ireland', 'rathbourne', ',', 'ashtown', ',', 'dublin_15', ',', 'ireland', 'residential', 'mazars']",rathbourne ashtown dublin_15 ireland rathbourne ashtown dublin_15 ireland residential mazars,3
187,,Rathbourne,Ashtown,Dublin 15,Ireland,"Rathbourne, Ashtown, Dublin 15, Ireland",Development - Not Commenced,,Mazars,"Rathbourne Ashtown Dublin 15 Ireland Rathbourne, Ashtown, Dublin 15, Ireland Development - Not Commenced nan Mazars","rathbourne ashtown dublin_15 ireland rathbourne, ashtown, dublin_15, ireland development - not commenced mazars","['rathbourne', 'ashtown', 'dublin_15', 'ireland', 'rathbourne', ',', 'ashtown', ',', 'dublin_15', ',', 'ireland', 'development', '-', 'not', 'commenced', 'mazars']",rathbourne ashtown dublin_15 ireland rathbourne ashtown dublin_15 ireland development not commenced mazars,3
189,,Ballycoolin Road,Blanchardstown,Dublin 15,Ireland,"Ballycoolin Road, Blanchardstown, Dublin 15, Ireland",Development - Not Commenced,,PwC,"Ballycoolin Road Blanchardstown Dublin 15 Ireland Ballycoolin Road, Blanchardstown, Dublin 15, Ireland Development - Not Commenced nan PwC","ballycoolin road blanchardstown dublin_15 ireland ballycoolin road, blanchardstown, dublin_15, ireland development - not commenced pwc","['ballycoolin', 'road', 'blanchardstown', 'dublin_15', 'ireland', 'ballycoolin', 'road', ',', 'blanchardstown', ',', 'dublin_15', ',', 'ireland', 'development', '-', 'not', 'commenced', 'pwc']",ballycoolin road blanchardstown dublin_15 ireland ballycoolin road blanchardstown dublin_15 ireland development not commenced pwc,3
190,,"Priorstown House,
Scribblestown",Castleknock,Dublin 15,Ireland,"Priorstown House,
Scribblestown, Castleknock, Dublin 15, Ireland",Development - Not Commenced,,RSM Farrell Grant Sparks,"Priorstown House,
Scribblestown Castleknock Dublin 15 Ireland Priorstown House,
Scribblestown, Castleknock, Dublin 15, Ireland Development - Not Commenced nan RSM Farrell Grant Sparks","priorstown house, scribblestown castleknock dublin_15 ireland priorstown house, scribblestown, castleknock, dublin_15, ireland development - not commenced rsm farrell grant sparks","['priorstown', 'house', ',', 'scribblestown', 'castleknock', 'dublin_15', 'ireland', 'priorstown', 'house', ',', 'scribblestown', ',', 'castleknock', ',', 'dublin_15', ',', 'ireland', 'development', '-', 'not', 'commenced', 'rsm', 'farrell', 'grant', 'sparks']",priorstown house scribblestown castleknock dublin_15 ireland priorstown house scribblestown castleknock dublin_15 ireland development not commenced rsm farrell grant sparks,3
191,,Chesterfield Grove,Castleknock,Dublin 15,Ireland,"Chesterfield Grove, Castleknock, Dublin 15, Ireland",Residential,,Ferris & Associates,"Chesterfield Grove Castleknock Dublin 15 Ireland Chesterfield Grove, Castleknock, Dublin 15, Ireland Residential nan Ferris & Associates","chesterfield grove castleknock dublin_15 ireland chesterfield grove, castleknock, dublin_15, ireland residential ferris & associates","['chesterfield', 'grove', 'castleknock', 'dublin_15', 'ireland', 'chesterfield', 'grove', ',', 'castleknock', ',', 'dublin_15', ',', 'ireland', 'residential', 'ferris', '&', 'associates']",chesterfield grove castleknock dublin_15 ireland chesterfield grove castleknock dublin_15 ireland residential ferris associates,3
192,,"Coolmine Enterprise
Centre",Castleknock,Dublin 15,Ireland,"Coolmine Enterprise
Centre, Castleknock, Dublin 15, Ireland",Office,,Ferris & Associates,"Coolmine Enterprise
Centre Castleknock Dublin 15 Ireland Coolmine Enterprise
Centre, Castleknock, Dublin 15, Ireland Office nan Ferris & Associates","coolmine enterprise centre castleknock dublin_15 ireland coolmine enterprise centre, castleknock, dublin_15, ireland office ferris & associates","['coolmine', 'enterprise', 'centre', 'castleknock', 'dublin_15', 'ireland', 'coolmine', 'enterprise', 'centre', ',', 'castleknock', ',', 'dublin_15', ',', 'ireland', 'office', 'ferris', '&', 'associates']",coolmine enterprise centre castleknock dublin_15 ireland coolmine enterprise centre castleknock dublin_15 ireland office ferris associates,3
193,,Hollywoodrath,Hollystown,Dublin 15,Ireland,"Hollywoodrath, Hollystown, Dublin 15, Ireland",Development - Not Commenced,,RSM Farrell Grant Sparks,"Hollywoodrath Hollystown Dublin 15 Ireland Hollywoodrath, Hollystown, Dublin 15, Ireland Development - Not Commenced nan RSM Farrell Grant Sparks","hollywoodrath hollystown dublin_15 ireland hollywoodrath, hollystown, dublin_15, ireland development - not commenced rsm farrell grant sparks","['hollywoodrath', 'hollystown', 'dublin_15', 'ireland', 'hollywoodrath', ',', 'hollystown', ',', 'dublin_15', ',', 'ireland', 'development', '-', 'not', 'commenced', 'rsm', 'farrell', 'grant', 'sparks']",hollywoodrath hollystown dublin_15 ireland hollywoodrath hollystown dublin_15 ireland development not commenced rsm farrell grant sparks,3
194,,Three units,Keypoint Business Park,Dublin 15,Ireland,"Three units, Keypoint Business Park, Dublin 15, Ireland",Industrial,,McStay Luby,"Three units Keypoint Business Park Dublin 15 Ireland Three units, Keypoint Business Park, Dublin 15, Ireland Industrial nan McStay Luby","three units keypoint business park dublin_15 ireland three units, keypoint business park, dublin_15, ireland industrial mcstay luby","['three', 'units', 'keypoint', 'business', 'park', 'dublin_15', 'ireland', 'three', 'units', ',', 'keypoint', 'business', 'park', ',', 'dublin_15', ',', 'ireland', 'industrial', 'mcstay', 'luby']",three units keypoint business park dublin_15 ireland three units keypoint business park dublin_15 ireland industrial mcstay luby,3
195,,"Old Quarry Industrial
Park","Northwest Business
Park",Dublin 15,Ireland,"Old Quarry Industrial
Park, Northwest Business
Park, Dublin 15, Ireland",Industrial,,McStay Luby,"Old Quarry Industrial
Park Northwest Business
Park Dublin 15 Ireland Old Quarry Industrial
Park, Northwest Business
Park, Dublin 15, Ireland Industrial nan McStay Luby","old quarry industrial park northwest business park dublin_15 ireland old quarry industrial park, northwest business park, dublin_15, ireland industrial mcstay luby","['old', 'quarry', 'industrial', 'park', 'northwest', 'business', 'park', 'dublin_15', 'ireland', 'old', 'quarry', 'industrial', 'park', ',', 'northwest', 'business', 'park', ',', 'dublin_15', ',', 'ireland', 'industrial', 'mcstay', 'luby']",old quarry industrial park northwest business park dublin_15 ireland old quarry industrial park northwest business park dublin_15 ireland industrial mcstay luby,3
196,,"Ballintyre Hall and
Ballintyre House",Ballinteer,Dublin 16,Ireland,"Ballintyre Hall and
Ballintyre House, Ballinteer, Dublin 16, Ireland",Residential,,Grant Thornton,"Ballintyre Hall and
Ballintyre House Ballinteer Dublin 16 Ireland Ballintyre Hall and
Ballintyre House, Ballinteer, Dublin 16, Ireland Residential nan Grant Thornton","ballintyre hall and ballintyre house ballinteer dublin_16 ireland ballintyre hall and ballintyre house, ballinteer, dublin_16, ireland residential grant thornton","['ballintyre', 'hall', 'and', 'ballintyre', 'house', 'ballinteer', 'dublin_16', 'ireland', 'ballintyre', 'hall', 'and', 'ballintyre', 'house', ',', 'ballinteer', ',', 'dublin_16', ',', 'ireland', 'residential', 'grant', 'thornton']",ballintyre hall and ballintyre house ballinteer dublin_16 ireland ballintyre hall and ballintyre house ballinteer dublin_16 ireland residential grant thornton,3
199,,Chivers,Coolock Drive,Dublin 17,Ireland,"Chivers, Coolock Drive, Dublin 17, Ireland",Development - Not Commenced,,Deloitte,"Chivers Coolock Drive Dublin 17 Ireland Chivers, Coolock Drive, Dublin 17, Ireland Development - Not Commenced nan Deloitte","chivers coolock drive dublin_17 ireland chivers, coolock drive, dublin_17, ireland development - not commenced deloitte","['chivers', 'coolock', 'drive', 'dublin_17', 'ireland', 'chivers', ',', 'coolock', 'drive', ',', 'dublin_17', ',', 'ireland', 'development', '-', 'not', 'commenced', 'deloitte']",chivers coolock drive dublin_17 ireland chivers coolock drive dublin_17 ireland development not commenced deloitte,3
